{"bindings":[{"adapter_binding_id":"bnd_11111111-1111-4111-8111-111111111111","adapter_id":"granola","capability":"meeting-source","configuration_sha256":"sha256:d19b361772dec7d2d66c5dd7991fd7e3357205d2d15c600643a2b6ec6479c494","configuration_snapshot":{"base_url":"https://api.granola.test/v1","cursor_overlap_ms":0,"page_size":1,"request_timeout_ms":15000},"connection_generation":1,"connection_id":"con_22222222-2222-4222-8222-222222222222","created_at":"2026-07-19T23:00:00.000Z","ended_at":null,"instance_id":"primary","status":"active"},{"adapter_binding_id":"bnd_22222222-2222-4222-8222-222222222222","adapter_id":"structured-text","capability":"decision-processor","configuration_sha256":"sha256:44136fa355b3678a1146ad16f7e8649e94fb4fc21fe77e8310c060f61caaff8a","configuration_snapshot":{},"connection_generation":null,"connection_id":null,"created_at":"2026-07-19T23:00:00.000Z","ended_at":null,"instance_id":"primary","status":"active"},{"adapter_binding_id":"bnd_33333333-3333-4333-8333-333333333333","adapter_id":"slack","capability":"delivery-surface","configuration_sha256":"sha256:57516b751573ea6f9930ab65716d58414750f6c931afee51e47c798861c0d6bd","configuration_snapshot":{"channel_id":"C123DECISIONS","request_timeout_ms":60000},"connection_generation":1,"connection_id":"con_11111111-1111-4111-8111-111111111111","created_at":"2026-07-19T23:00:00.000Z","ended_at":null,"instance_id":"team-decisions","status":"active"},{"adapter_binding_id":"bnd_44444444-4444-4444-8444-444444444444","adapter_id":"slack-reactions","capability":"approval-surface","configuration_sha256":"sha256:a626d165e2aa89a630f573580db91e2c9beeb1bb0974b7e9106822a5a818246b","configuration_snapshot":{"approve_reaction":"white_check_mark","channel_id":"C123APPROVALS","reject_reaction":"x","request_timeout_ms":60000,"reviewer":{"name":"Founder","slack_user_id":"U123FOUNDER"}},"connection_generation":1,"connection_id":"con_11111111-1111-4111-8111-111111111111","created_at":"2026-07-19T23:00:00.000Z","ended_at":null,"instance_id":"founder-approval","status":"active"}],"connections":[{"connection_id":"con_11111111-1111-4111-8111-111111111111","generations":[{"active_from":"2026-07-19T23:00:00.000Z","ended_at":null,"generation":1,"local_credential_guard":{"algorithm":"sha256-salted","digest":"sha256:981059d7d383ade6b1987374ab0b1fb30b97c06f6b2cc50f9ba97a650c2ea550","exportable":false,"reference":"file:/private/slack-token","salt_base64":"AQEBAQEBAQEBAQEBAQEBAQEBAQEBAQEBAQEBAQEBAQE="},"provider_identity":{"subject":{"app_id":"A123APP","bot_id":"B123BOT","id":"U123BOT","kind":"bot-installation"},"tenant":{"enterprise_id":null,"id":"T123TEAM","kind":"slack-team"},"verification":{"assurance":"provider_verified","evidence_sha256":"sha256:39ae320ceebd166755eb19543b993bf3ed8e4f353ba6b277cebe26a832a51e79","method":"slack_auth_test","verified_at":"2026-07-19T23:00:00.000Z"}}}],"organization_id":"org_aaaaaaaa-aaaa-4aaa-8aaa-aaaaaaaaaaaa","owner":{"id":"org_aaaaaaaa-aaaa-4aaa-8aaa-aaaaaaaaaaaa","kind":"organization"},"provider":"slack"},{"connection_id":"con_22222222-2222-4222-8222-222222222222","generations":[{"active_from":"2026-07-19T23:00:00.000Z","ended_at":null,"generation":1,"local_credential_guard":{"algorithm":"sha256-salted","digest":"sha256:b051af303a301e45aff3424baae639e65b0afa8b65f79f8fe01b3a81ef23c71b","exportable":false,"reference":"file:/private/granola-token","salt_base64":"AgICAgICAgICAgICAgICAgICAgICAgICAgICAgICAgI="},"provider_identity":{"subject":null,"tenant":null,"verification":{"assurance":"credential_observed","evidence_sha256":"sha256:6780a1257daf61c58103fbd58a46e9db3a9a3c279317807cf4d1639c36da7e95","method":"provider_first_capture","verified_at":"2026-07-19T23:00:00.000Z"}}}],"organization_id":"org_aaaaaaaa-aaaa-4aaa-8aaa-aaaaaaaaaaaa","owner":{"id":"mem_cccccccc-cccc-4ccc-8ccc-cccccccccccc","kind":"membership"},"provider":"granola"}],"identity_manifest_id":"idm_11111111-1111-4111-8111-111111111111","integrity":{"canonicalization":"RFC8785","key_id":"sha256:bfd16b896c8320ae199b684cdb03c6bb39d062442e4352fd4a2275ae1d826c70","payload_sha256":"sha256:f3e17006ea456468f721ace8d06b26941b24ce0cb526a8b1481b283a671bab07","signature_algorithm":"ecdsa-p256-sha256-der-low-s","signature_base64":"MEQCIATPt3yCym5OlsyfyNIYmoz5R0qrZwmnHf+K2JvI85klAiBHyBGvkDtg7A/CHOasSmitZaH8s0qtDI2q4B8euuxo8w=="},"kind":"echo-local-connection-registry","previous_registry_sha256":null,"registry_id":"reg_22222222-2222-4222-8222-222222222222","revision":1,"schema_version":1,"updated_at":"2026-07-19T23:00:00.000Z"}